{
  "schema": "personaplex.diverse-seed-library.v2",
  "libraryId": "personaplex-call-diversity-50-causal-v2",
  "purpose": "Fifty non-identifying conversation domains for a factorized PersonaPlex semantic-control corpus. Every domain must yield twenty distinct premises and ten eligible trajectories while reusing the same three causal operators across unrelated topics so held-out evaluation measures learned control rather than scenario memorization.",
  "seeds": [
    {
      "id": "S01",
      "title": "Everyday relationship repair",
      "focus": "apologies, boundaries, misunderstandings, and gradual trust repair",
      "causalAffordances": [
        {
          "family": "semantic",
          "operatorId": "evidence_status_transition",
          "changedPath": "state.evidence.status",
          "siblingValues": {
            "verified_positive": "verified and actionable",
            "verified_negative": "verified false or unavailable",
            "uncertain": "not yet verified",
            "superseded": "replaced by a newer revision"
          }
        },
        {
          "family": "delivery",
          "operatorId": "next_goal_route_transition",
          "changedPath": "plan.nextGoal",
          "siblingValues": {
            "verified_positive": "proceed with supported resolution",
            "verified_negative": "decline unsupported resolution and offer valid alternatives",
            "uncertain": "clarify or verify before committing",
            "superseded": "abandon stale goal and follow the newer route"
          }
        },
        {
          "family": "turn_taking",
          "operatorId": "interruption_recovery_transition",
          "changedPath": "turnTaking.eventType",
          "siblingValues": {
            "verified_positive": "complete the current turn",
            "verified_negative": "stop the invalid response",
            "uncertain": "wait or use a safe backchannel",
            "superseded": "repair after cancellation using the acknowledged revision"
          }
        }
      ]
    },
    {
      "id": "S02",
      "title": "Neighbors and shared spaces",
      "focus": "noise, packages, maintenance, favors, and practical compromises",
      "causalAffordances": [
        {
          "family": "semantic",
          "operatorId": "evidence_status_transition",
          "changedPath": "state.evidence.status",
          "siblingValues": {
            "verified_positive": "verified and actionable",
            "verified_negative": "verified false or unavailable",
            "uncertain": "not yet verified",
            "superseded": "replaced by a newer revision"
          }
        },
        {
          "family": "delivery",
          "operatorId": "next_goal_route_transition",
          "changedPath": "plan.nextGoal",
          "siblingValues": {
            "verified_positive": "proceed with supported resolution",
            "verified_negative": "decline unsupported resolution and offer valid alternatives",
            "uncertain": "clarify or verify before committing",
            "superseded": "abandon stale goal and follow the newer route"
          }
        },
        {
          "family": "turn_taking",
          "operatorId": "interruption_recovery_transition",
          "changedPath": "turnTaking.eventType",
          "siblingValues": {
            "verified_positive": "complete the current turn",
            "verified_negative": "stop the invalid response",
            "uncertain": "wait or use a safe backchannel",
            "superseded": "repair after cancellation using the acknowledged revision"
          }
        }
      ]
    },
    {
      "id": "S03",
      "title": "Moving and settling in",
      "focus": "local discovery, utilities, belongings, routines, and social adjustment",
      "causalAffordances": [
        {
          "family": "semantic",
          "operatorId": "evidence_status_transition",
          "changedPath": "state.evidence.status",
          "siblingValues": {
            "verified_positive": "verified and actionable",
            "verified_negative": "verified false or unavailable",
            "uncertain": "not yet verified",
            "superseded": "replaced by a newer revision"
          }
        },
        {
          "family": "delivery",
          "operatorId": "next_goal_route_transition",
          "changedPath": "plan.nextGoal",
          "siblingValues": {
            "verified_positive": "proceed with supported resolution",
            "verified_negative": "decline unsupported resolution and offer valid alternatives",
            "uncertain": "clarify or verify before committing",
            "superseded": "abandon stale goal and follow the newer route"
          }
        },
        {
          "family": "turn_taking",
          "operatorId": "interruption_recovery_transition",
          "changedPath": "turnTaking.eventType",
          "siblingValues": {
            "verified_positive": "complete the current turn",
            "verified_negative": "stop the invalid response",
            "uncertain": "wait or use a safe backchannel",
            "superseded": "repair after cancellation using the acknowledged revision"
          }
        }
      ]
    },
    {
      "id": "S04",
      "title": "Family logistics",
      "focus": "visits, caregiving coordination, celebrations, and changing plans",
      "causalAffordances": [
        {
          "family": "semantic",
          "operatorId": "evidence_status_transition",
          "changedPath": "state.evidence.status",
          "siblingValues": {
            "verified_positive": "verified and actionable",
            "verified_negative": "verified false or unavailable",
            "uncertain": "not yet verified",
            "superseded": "replaced by a newer revision"
          }
        },
        {
          "family": "delivery",
          "operatorId": "next_goal_route_transition",
          "changedPath": "plan.nextGoal",
          "siblingValues": {
            "verified_positive": "proceed with supported resolution",
            "verified_negative": "decline unsupported resolution and offer valid alternatives",
            "uncertain": "clarify or verify before committing",
            "superseded": "abandon stale goal and follow the newer route"
          }
        },
        {
          "family": "turn_taking",
          "operatorId": "interruption_recovery_transition",
          "changedPath": "turnTaking.eventType",
          "siblingValues": {
            "verified_positive": "complete the current turn",
            "verified_negative": "stop the invalid response",
            "uncertain": "wait or use a safe backchannel",
            "superseded": "repair after cancellation using the acknowledged revision"
          }
        }
      ]
    },
    {
      "id": "S05",
      "title": "Friendship and social plans",
      "focus": "invitations, cancellations, reconnection, group coordination, and tact",
      "causalAffordances": [
        {
          "family": "semantic",
          "operatorId": "evidence_status_transition",
          "changedPath": "state.evidence.status",
          "siblingValues": {
            "verified_positive": "verified and actionable",
            "verified_negative": "verified false or unavailable",
            "uncertain": "not yet verified",
            "superseded": "replaced by a newer revision"
          }
        },
        {
          "family": "delivery",
          "operatorId": "next_goal_route_transition",
          "changedPath": "plan.nextGoal",
          "siblingValues": {
            "verified_positive": "proceed with supported resolution",
            "verified_negative": "decline unsupported resolution and offer valid alternatives",
            "uncertain": "clarify or verify before committing",
            "superseded": "abandon stale goal and follow the newer route"
          }
        },
        {
          "family": "turn_taking",
          "operatorId": "interruption_recovery_transition",
          "changedPath": "turnTaking.eventType",
          "siblingValues": {
            "verified_positive": "complete the current turn",
            "verified_negative": "stop the invalid response",
            "uncertain": "wait or use a safe backchannel",
            "superseded": "repair after cancellation using the acknowledged revision"
          }
        }
      ]
    },
    {
      "id": "S06",
      "title": "Pets and animal care",
      "focus": "appointments, behavior, supplies, boarding, and reassurance",
      "causalAffordances": [
        {
          "family": "semantic",
          "operatorId": "evidence_status_transition",
          "changedPath": "state.evidence.status",
          "siblingValues": {
            "verified_positive": "verified and actionable",
            "verified_negative": "verified false or unavailable",
            "uncertain": "not yet verified",
            "superseded": "replaced by a newer revision"
          }
        },
        {
          "family": "delivery",
          "operatorId": "next_goal_route_transition",
          "changedPath": "plan.nextGoal",
          "siblingValues": {
            "verified_positive": "proceed with supported resolution",
            "verified_negative": "decline unsupported resolution and offer valid alternatives",
            "uncertain": "clarify or verify before committing",
            "superseded": "abandon stale goal and follow the newer route"
          }
        },
        {
          "family": "turn_taking",
          "operatorId": "interruption_recovery_transition",
          "changedPath": "turnTaking.eventType",
          "siblingValues": {
            "verified_positive": "complete the current turn",
            "verified_negative": "stop the invalid response",
            "uncertain": "wait or use a safe backchannel",
            "superseded": "repair after cancellation using the acknowledged revision"
          }
        }